CVE ID,CVE Type,Description,Max CVSS,EPSS Score,Published,Updated
CVE-2018-1999024,N/A,MathJax version prior to version 2.7.4 contains a Cross Site Scripting (XSS) vulnerability in the \unicode{} macro that can result in Potentially untrusted Javascript running within a web browser. This attack appear to be exploitable via The victim must view a page where untrusted content is processed using Mathjax. This vulnerability appears to have been fixed in 2.7.4 and later.,5.4,0.19%,2018-07-23,2018-09-19
CVE-2018-1999023,N/A,"The Battle for Wesnoth Project version 1.7.0 through 1.14.3 contains a Code Injection vulnerability in the Lua scripting engine that can result in code execution outside the sandbox. This attack appear to be exploitable via Loading specially-crafted saved games, networked games, replays, and player content.",8.8,0.73%,2018-07-23,2018-09-20
CVE-2018-1999022,N/A,"PEAR HTML_QuickForm version 3.2.14 contains an eval injection (CWE-95) vulnerability in HTML_QuickForm's getSubmitValue method, HTML_QuickForm's validate method, HTML_QuickForm_hierselect's _setOptions method, HTML_QuickForm_element's _findValue method, HTML_QuickForm_element's _prepareValue method. that can result in Possible information disclosure, possible impact on data integrity and execution of arbitrary code. This attack appear to be exploitable via A specially crafted query string could be utilised, e.g. http://www.example.com/admin/add_practice_type_id[1]=fubar%27])%20OR%20die(%27OOK!%27);%20//&mode=live. This vulnerability appears to have been fixed in 3.2.15.",9.8,1.40%,2018-07-23,2018-10-03
CVE-2018-1999021,N/A,Gleezcms Gleez Cms version 1.3.0 contains a Cross Site Scripting (XSS) vulnerability in Profile page that can result in Inject arbitrary web script or HTML via the profile page editor. This attack appear to be exploitable via The victim must navigate to the attacker's profile page.,5.4,0.21%,2018-07-23,2018-09-19
CVE-2018-1999020,N/A,Open Networking Foundation (ONF) ONOS version 1.13.2 and earlier version contains a Directory Traversal vulnerability in core/common/src/main/java/org/onosproject/common/app/ApplicationArchive.java line 35 that can result in arbitrary file deletion (overwrite). This attack appear to be exploitable via a specially crafted zip file should be uploaded.,5.8,1.97%,2018-07-23,2018-09-20
CVE-2018-1999019,N/A,"Chamilo LMS version 11.x contains an Unserialization vulnerability in the ""hash"" GET parameter for the api endpoint located at /webservices/api/v2.php that can result in Unauthenticated remote code execution. This attack appear to be exploitable via a simple GET request to the api endpoint. This vulnerability appears to have been fixed in After commit 0de84700648f098c1fbf6b807dee28ec640efe62.",9.8,1.77%,2018-07-23,2019-09-17
CVE-2018-1999018,N/A,"Pydio version 8.2.1 and prior contains an Unvalidated user input leading to Remote Code Execution (RCE) vulnerability in plugins/action.antivirus/AntivirusScanner.php: Line 124, scanNow($nodeObject) that can result in An attacker gaining admin access and can then execute arbitrary commands on the underlying OS. This attack appear to be exploitable via The attacker edits the Antivirus Command in the antivirus plugin, and executes the payload by uploading any file within Pydio.",8.5,2.82%,2018-07-23,2018-09-20
CVE-2018-1999017,N/A,"Pydio version 8.2.0 and earlier contains a Server-Side Request Forgery (SSRF) vulnerability in plugins/action.updater/UpgradeManager.php Line: 154, getUpgradePath($url) that can result in an authenticated admin users requesting arbitrary URL's, pivoting requests through the server. This attack appears to be exploitable via the attacker gaining access to an administrative account, enters a URL into Upgrade Engine, and reloads the page or presses ""Check Now"". This vulnerability appears to have been fixed in 8.2.1.",4.9,0.35%,2018-07-23,2018-09-20
CVE-2018-1999016,N/A,"Pydio version 8.2.0 and earlier contains a Cross Site Scripting (XSS) vulnerability in ./core/vendor/meenie/javascript-packer/example-inline.php line 48; ./core/vendor/dapphp/securimage/examples/test.mysql.static.php lines: 114,118 that can result in an unauthenticated remote attacker manipulating the web client via XSS code injection. This attack appear to be exploitable via the victim openning a specially crafted URL. This vulnerability appears to have been fixed in version 8.2.1.",6.1,0.19%,2018-07-23,2018-09-19
CVE-2018-1999015,N/A,FFmpeg before commit 5aba5b89d0b1d73164d3b81764828bb8b20ff32a contains an out of array read vulnerability in ASF_F format demuxer that can result in heap memory reading. This attack appear to be exploitable via specially crafted ASF file that has to provided as input. This vulnerability appears to have been fixed in 5aba5b89d0b1d73164d3b81764828bb8b20ff32a and later.,6.5,0.36%,2018-07-23,2018-09-20
CVE-2018-1999014,N/A,FFmpeg before commit bab0716c7f4793ec42e05a5aa7e80d82a0dd4e75 contains an out of array access vulnerability in MXF format demuxer that can result in DoS. This attack appear to be exploitable via specially crafted MXF file which has to be provided as input. This vulnerability appears to have been fixed in bab0716c7f4793ec42e05a5aa7e80d82a0dd4e75 and later.,6.5,0.40%,2018-07-23,2018-09-19
CVE-2018-1999013,N/A,FFmpeg before commit a7e032a277452366771951e29fd0bf2bd5c029f0 contains a use-after-free vulnerability in the realmedia demuxer that can result in vulnerability allows attacker to read heap memory. This attack appear to be exploitable via specially crafted RM file has to be provided as input. This vulnerability appears to have been fixed in a7e032a277452366771951e29fd0bf2bd5c029f0 and later.,6.5,0.36%,2018-07-23,2018-09-20
CVE-2018-1999012,N/A,FFmpeg before commit 9807d3976be0e92e4ece3b4b1701be894cd7c2e1 contains a CWE-835: Infinite loop vulnerability in pva format demuxer that can result in a Vulnerability that allows attackers to consume excessive amount of resources like CPU and RAM. This attack appear to be exploitable via specially crafted PVA file has to be provided as input. This vulnerability appears to have been fixed in 9807d3976be0e92e4ece3b4b1701be894cd7c2e1 and later.,7.1,0.50%,2018-07-23,2019-10-03
CVE-2018-1999011,N/A,FFmpeg before commit 2b46ebdbff1d8dec7a3d8ea280a612b91a582869 contains a Buffer Overflow vulnerability in asf_o format demuxer that can result in heap-buffer-overflow that may result in remote code execution. This attack appears to be exploitable via specially crafted ASF file that has to be provided as input to FFmpeg. This vulnerability appears to have been fixed in 2b46ebdbff1d8dec7a3d8ea280a612b91a582869 and later.,8.8,3.79%,2018-07-23,2019-05-23
CVE-2018-1999010,N/A,FFmpeg before commit cced03dd667a5df6df8fd40d8de0bff477ee02e8 contains multiple out of array access vulnerabilities in the mms protocol that can result in attackers accessing out of bound data. This attack appear to be exploitable via network connectivity. This vulnerability appears to have been fixed in cced03dd667a5df6df8fd40d8de0bff477ee02e8 and later.,9.8,0.53%,2018-07-23,2019-03-27
CVE-2018-1999009,N/A,October CMS version prior to Build 437 contains a Local File Inclusion vulnerability in modules/system/traits/ViewMaker.php#244 (makeFileContents function) that can result in Sensitive information disclosure and remote code execution. This attack appear to be exploitable remotely if the /backend path is accessible. This vulnerability appears to have been fixed in Build 437.,8.1,1.89%,2018-07-23,2020-08-03
CVE-2018-1999008,N/A,October CMS version prior to build 437 contains a Cross Site Scripting (XSS) vulnerability in the Media module and create folder functionality that can result in an Authenticated user with media module permission creating arbitrary folder name with XSS content. This attack appear to be exploitable via an Authenticated user with media module permission who can create arbitrary folder name (XSS). This vulnerability appears to have been fixed in build 437.,5.4,0.33%,2018-07-23,2020-08-03
CVE-2018-1999007,N/A,"A cross-site scripting vulnerability exists in Jenkins 2.132 and earlier, 2.121.1 and earlier in the Stapler web framework's org/kohsuke/stapler/Stapler.java that allows attackers with the ability to control the existence of some URLs in Jenkins to define JavaScript that would be executed in another user's browser when that other user views HTTP 404 error pages while Stapler debug mode is enabled.",5.4,0.22%,2018-07-23,2022-06-13
CVE-2018-1999006,N/A,"A exposure of sensitive information vulnerability exists in Jenkins 2.132 and earlier, 2.121.1 and earlier in Plugin.java that allows attackers to determine the date and time when a plugin HPI/JPI file was last extracted, which typically is the date of the most recent installation/upgrade.",4.3,0.09%,2018-07-23,2019-05-08
CVE-2018-1999005,N/A,"A cross-site scripting vulnerability exists in Jenkins 2.132 and earlier, 2.121.1 and earlier in BuildTimelineWidget.java, BuildTimelineWidget/control.jelly that allows attackers with Job/Configure permission to define JavaScript that would be executed in another user's browser when that other user performs some UI actions.",5.4,0.22%,2018-07-23,2022-06-13
CVE-2018-1999004,N/A,"A Improper authorization vulnerability exists in Jenkins 2.132 and earlier, 2.121.1 and earlier in SlaveComputer.java that allows attackers with Overall/Read permission to initiate agent launches, and abort in-progress agent launches.",4.3,0.20%,2018-07-23,2022-06-13
CVE-2018-1999003,N/A,"A Improper authorization vulnerability exists in Jenkins 2.132 and earlier, 2.121.1 and earlier in Queue.java that allows attackers with Overall/Read permission to cancel queued builds.",4.3,0.15%,2018-07-23,2022-06-13
CVE-2018-1999002,N/A,"A arbitrary file read vulnerability exists in Jenkins 2.132 and earlier, 2.121.1 and earlier in the Stapler web framework's org/kohsuke/stapler/Stapler.java that allows attackers to send crafted HTTP requests returning the contents of any file on the Jenkins master file system that the Jenkins master has access to.",7.5,93.33%,2018-07-23,2022-06-13
CVE-2018-1999001,N/A,"A unauthorized modification of configuration vulnerability exists in Jenkins 2.132 and earlier, 2.121.1 and earlier in User.java that allows attackers to provide crafted login credentials that cause Jenkins to move the config.xml file from the Jenkins home directory. If Jenkins is started without this file present, it will revert to the legacy defaults of granting administrator access to anonymous users.",8.8,40.86%,2018-07-23,2022-06-13
CVE-2018-1002209,N/A,"QuaZIP before 0.7.6 is vulnerable to directory traversal, allowing attackers to write to arbitrary files via a ../ (dot dot slash) in a Zip archive entry that is mishandled during extraction. This vulnerability is also known as 'Zip-Slip'.",5.5,1.35%,2018-07-25,2019-10-09
