CVE ID,CVE Type,Description,Max CVSS,EPSS Score,Published,Updated
CVE-2022-48196,N/A,"Certain NETGEAR devices are affected by a buffer overflow by an unauthenticated attacker. This affects RAX40 before 1.0.2.60, RAX35 before 1.0.2.60, R6400v2 before 1.0.4.122, R6700v3 before 1.0.4.122, R6900P before 1.3.3.152, R7000P before 1.3.3.152, R7000 before 1.0.11.136, R7960P before 1.4.4.94, and R8000P before 1.4.4.94.",9.8,0.46%,2022-12-30,2023-01-10
CVE-2022-48195,N/A,"An issue was discovered in Mellium mellium.im/sasl before 0.3.1. When performing SCRAM-based SASL authentication, if the remote end advertises support for channel binding, no random nonce is generated (instead, the nonce is empty). This causes authentication to fail in the best case, but (if paired with a remote end that does not validate the length of the nonce) could lead to insufficient randomness being used during authentication.",9.8,0.33%,2022-12-31,2023-01-09
CVE-2022-48194,N/A,TP-Link TL-WR902AC devices through V3 0.9.1 allow remote authenticated attackers to execute arbitrary code or cause a Denial of Service (DoS) by uploading a crafted firmware update because the signature check is inadequate.,8.8,64.76%,2022-12-30,2023-04-03
CVE-2022-47968,N/A,"Heimdall Application Dashboard through 2.5.4 allows reflected and stored XSS via ""Application name"" to the ""Add application"" page. The stored XSS will be triggered in the ""Application list"" page.",5.4,0.09%,2022-12-27,2023-01-05
CVE-2022-47949,N/A,"The Nintendo NetworkBuffer class, as used in Animal Crossing: New Horizons before 2.0.6 and other products, allows remote attackers to execute arbitrary code via a large UDP packet that causes a buffer overflow, aka ENLBufferPwn. The victim must join a game session with the attacker. Other affected products include Mario Kart 7 before 1.2, Mario Kart 8, Mario Kart 8 Deluxe before 2.1.0, ARMS before 5.4.1, Splatoon, Splatoon 2 before 5.5.1, Splatoon 3 before late 2022, Super Mario Maker 2 before 3.0.2, and Nintendo Switch Sports before late 2022.",9.8,38.32%,2022-12-24,2023-01-06
CVE-2022-47946,N/A,"An issue was discovered in the Linux kernel 5.10.x before 5.10.155. A use-after-free in io_sqpoll_wait_sq in fs/io_uring.c allows an attacker to crash the kernel, resulting in denial of service. finish_wait can be skipped. An attack can occur in some situations by forking a process and then quickly terminating it. NOTE: later kernel versions, such as the 5.15 longterm series, substantially changed the implementation of io_sqpoll_wait_sq.",5.5,0.02%,2022-12-23,2023-01-04
CVE-2022-47945,N/A,"ThinkPHP Framework before 6.0.14 allows local file inclusion via the lang parameter when the language pack feature is enabled (lang_switch_on=true). An unauthenticated and remote attacker can exploit this to execute arbitrary operating system commands, as demonstrated by including pearcmd.php.",9.8,87.80%,2022-12-23,2022-12-30
CVE-2022-47943,N/A,"An issue was discovered in ksmbd in the Linux kernel 5.15 through 5.19 before 5.19.2. There is an out-of-bounds read and OOPS for SMB2_WRITE, when there is a large length in the zero DataOffset case.",8.1,0.87%,2022-12-23,2023-05-16
CVE-2022-47942,N/A,"An issue was discovered in ksmbd in the Linux kernel 5.15 through 5.19 before 5.19.2. There is a heap-based buffer overflow in set_ntacl_dacl, related to use of SMB2_QUERY_INFO_HE after a malformed SMB2_SET_INFO_HE command.",8.8,0.09%,2022-12-23,2023-05-16
CVE-2022-47941,N/A,"An issue was discovered in ksmbd in the Linux kernel 5.15 through 5.19 before 5.19.2. fs/ksmbd/smb2pdu.c omits a kfree call in certain smb2_handle_negotiate error conditions, aka a memory leak.",7.5,0.28%,2022-12-23,2023-05-16
CVE-2022-47940,N/A,An issue was discovered in ksmbd in the Linux kernel 5.15 through 5.18 before 5.18.18. fs/ksmbd/smb2pdu.c lacks length validation in the non-padding case in smb2_write.,8.1,0.16%,2022-12-23,2024-08-21
CVE-2022-47939,N/A,An issue was discovered in ksmbd in the Linux kernel 5.15 through 5.19 before 5.19.2. fs/ksmbd/smb2pdu.c has a use-after-free and OOPS for SMB2_TREE_DISCONNECT.,9.8,0.88%,2022-12-23,2023-05-16
CVE-2022-47938,N/A,An issue was discovered in ksmbd in the Linux kernel 5.15 through 5.19 before 5.19.2. fs/ksmbd/smb2misc.c has an out-of-bounds read and OOPS for SMB2_TREE_CONNECT.,6.5,0.29%,2022-12-23,2023-01-23
CVE-2022-47934,N/A,Brave Browser before 1.43.88 allowed a remote attacker to cause a denial of service in private and guest windows via a crafted HTML file that mentions an ipfs:// or ipns:// URL. This is caused by an incomplete fix for CVE-2022-47932 and CVE-2022-47934.,6.5,0.21%,2022-12-24,2022-12-30
CVE-2022-47933,N/A,Brave Browser before 1.42.51 allowed a remote attacker to cause a denial of service via a crafted HTML file that references the IPFS scheme. This vulnerability is caused by an uncaught exception in the function ipfs::OnBeforeURLRequest_IPFSRedirectWork() in ipfs_redirect_network_delegate_helper.cc.,6.5,0.21%,2022-12-24,2022-12-30
CVE-2022-47932,N/A,Brave Browser before 1.43.34 allowed a remote attacker to cause a denial of service via a crafted HTML file that mentions an ipfs:// or ipns:// URL. This vulnerability is caused by an incomplete fix for CVE-2022-47933.,6.5,0.27%,2022-12-24,2022-12-30
CVE-2022-47931,N/A,IO FinNet tss-lib before 2.0.0 allows a collision of hash values.,9.1,0.05%,2022-12-23,2023-04-21
CVE-2022-47928,N/A,"In MISP before 2.4.167, there is XSS in the template file uploads in app/View/Templates/upload_file.ctp.",6.1,0.10%,2022-12-22,2024-01-09
CVE-2022-47926,N/A,AyaCMS 3.1.2 is vulnerable to file deletion via /aya/module/admin/fst_del.inc.php,9.8,0.13%,2022-12-22,2023-01-05
CVE-2022-47896,N/A,In JetBrains IntelliJ IDEA before 2022.3.1 code Templates were vulnerable to SSTI attacks.,7.8,0.00%,2022-12-22,2022-12-29
CVE-2022-47895,N/A,"In JetBrains IntelliJ IDEA before 2022.3.1 the ""Validate JSP File"" action used the HTTP protocol to download required JAR files.",7.5,0.00%,2022-12-22,2022-12-29
CVE-2022-47635,N/A,"Wildix WMS 6 before 6.02.20221216, WMS 5 before 5.04.20221214, and WMS4 before 4.04.45396.23 allows Server-side request forgery (SSRF) via ZohoClient.php.",9.8,0.08%,2022-12-21,2023-01-03
CVE-2022-47633,N/A,An image signature validation bypass vulnerability in Kyverno 1.8.3 and 1.8.4 allows a malicious image registry (or a man-in-the-middle attacker) to inject unsigned arbitrary container images into a protected Kubernetes cluster. This is fixed in 1.8.5. This has been fixed in 1.8.5 and mitigations are available for impacted releases.,8.1,0.05%,2022-12-23,2023-01-04
CVE-2022-47629,N/A,Libksba before 1.6.3 is prone to an integer overflow vulnerability in the CRL signature parser.,9.8,1.84%,2022-12-20,2023-05-18
CVE-2022-47581,N/A,Isode M-Vault 16.0v0 through 17.x before 17.0v24 can crash upon an LDAP v1 bind request.,7.5,0.19%,2022-12-21,2022-12-28
